{
  "artifacts": [
    {
      "path": "artifacts/autosci/operator-smoke/skillgen/exp-001.log",
      "type": "experiment_run_log"
    },
    {
      "path": "artifacts/autosci/operator-smoke/skillgen/experiment_result.json",
      "type": "solar_evidence_json"
    }
  ],
  "inputs": {
    "execution_mode": "fixture",
    "experiment_plan_evidence": "artifacts/autosci/operator-smoke/skillgen/experiment_plan.json",
    "experiment_result": "plugins/autosci/tests/fixtures/sample_autosci_raw_experiment_result.json"
  },
  "limitations": [
    "Fixture result is deterministic and not a real benchmark run."
  ],
  "node_id": "node-run-experiment",
  "outputs": {
    "result": {
      "command_run": "python3 plugins/autosci/bin/autosci_bridge.py run --action run_experiment",
      "evidence_ids": [
        "evidence:autosci-fixture-result",
        "evidence:autosci-fixture-ledger"
      ],
      "execution_mode": "fixture",
      "exit_code": 0,
      "experiment_id": "exp-001",
      "logs": [
        "execution_mode=fixture",
        "experiment_id=exp-001",
        "command_run=python3 plugins/autosci/bin/autosci_bridge.py run --action run_experiment",
        "fixture result collected"
      ],
      "metrics": [
        {
          "name": "result_json_written",
          "value": true
        },
        {
          "name": "evidence_jsonl_written",
          "value": true
        }
      ],
      "outcome": "supports"
    }
  },
  "provenance": {
    "implementation_package": "plugins/autosci",
    "operator_id": "autosci-bridge",
    "timestamp": "2026-07-10T14:13:23Z"
  },
  "schema": "experiment_result.v1",
  "sprint_id": "phase19-skillgen-operator-smoke",
  "status": "completed",
  "task_id": "task-autosci-skillgen-run_experiment"
}
